{
  "schema_version": "1.0",
  "target": "metroid-fusion",
  "language": "ar",
  "notation": "Logical Arabic in the engine notation (engines.metroid_fusion). Keep every command of the original, in order. In the intro, {FC00} shows the arrow and waits for A, {FD00} starts a new page and {E1xx} waits xx frames. In a briefing, {81xx} colours the words that follow ({8100} ends the colour), {B003} starts its music, {E000} shows the target on the map, {FD00} waits for A and clears the box and {FB00} asks the objective question; keep colour commands between words. A question pushes its line to the middle ({80xx}, whose amount may change) and places its options with {8340} and {83A0}; it ends with a glyph. Line ends after text (\\n) may move; a page of the intro's strip holds two lines, a page of the monologue nine, a briefing's box two, of at most 224 pixels. Samus narrates in the first person, as a woman; the ship's computer speaks to her.",
  "glossary": [
    {
      "term": "SR388",
      "text": "إس آر ٣٨٨"
    },
    {
      "term": "X (the parasite)",
      "text": "إكس"
    },
    {
      "term": "Biologic",
      "text": "بيولوجيك"
    },
    {
      "term": "Biologic Space Labs",
      "text": "مختبرات بيولوجيك الفضائية"
    },
    {
      "term": "B.S.L",
      "text": "بي إس إل"
    },
    {
      "term": "Galactic Federation",
      "text": "الاتحاد المجري"
    },
    {
      "term": "Power Suit",
      "text": "بدلة القوة"
    },
    {
      "term": "Metroid",
      "text": "ميترويد"
    },
    {
      "term": "the ship's computer",
      "text": "حاسوب السفينة"
    },
    {
      "term": "CO",
      "text": "القائد"
    },
    {
      "term": "Samus",
      "text": "سامس"
    },
    {
      "term": "Quarantine Bay",
      "text": "عنبر الحجر الصحي"
    },
    {
      "term": "Navigation Room",
      "text": "غرفة الملاحة"
    },
    {
      "term": "X parasites",
      "text": "طفيليات إكس"
    },
    {
      "term": "bio-signs",
      "text": "علامات حياة"
    }
  ],
  "entries": [
    {
      "id": "watching_biologic",
      "context": "Samus; monologue 8",
      "text": "كنت مكلفة بحراسة فريق\nالأبحاث التابع لبيولوجيك،{FC00}{FD00}فوجدت نفسي مرة أخرى على\nسطح الكوكب إس آر ٣٨٨.{FC00}"
    },
    {
      "id": "attacked",
      "context": "Samus; monologue 9",
      "text": "وهناك تعرضت لهجوم كائن حي{FC00}{FD00}لم أعرف له مثيلا من قبل.{FC00}"
    },
    {
      "id": "the_x",
      "context": "Samus; monologue 10",
      "text": "ولم أعرف إلا فيما بعد\nهوية من هاجمني:{FC00}{FD00}إنه الكائن الطفيلي الذي\nنعرفه اليوم باسم إكس.{FC00}{FD00}ودون أن أدري بحالتي، كنت\nفي طريق عودتي إلى المحطة{FC00}{FD00}حين وقعت الكارثة.{FC00}"
    },
    {
      "id": "asteroid_belt",
      "context": "Samus; monologue 11",
      "text": "وما إن تغلغلت طفيليات إكس\nفي جهازي العصبي المركزي حتى{FC00}{FD00}فقدت وعيي، وانجرفت سفينتي\nنحو حزام من الكويكبات.{FC00}"
    },
    {
      "id": "escape_pod",
      "context": "Samus; monologue 12",
      "text": "قذفت أنظمة الطوارئ في\nالسفينة كبسولة النجاة تلقائيا{FC00}{FD00}قبل الاصطدام، فانتشلتها\nسفينة تابعة لبيولوجيك{FC00}{FD00}ونقلتني إلى مقر الاتحاد المجري.{FC00}{FC00}{FD00}{E132}لكن طفيليات إكس تكاثرت\nفي جسدي أثناء الرحلة،{FC00}{FD00}وأفسدت أجزاء واسعة من بدلة القوة.{FC00}"
    },
    {
      "id": "suit_integrated",
      "context": "Samus; monologue 13",
      "text": "ثم تبين أن المكونات\nالعضوية في بدلة القوة{FC00}{FD00}قد اندمجت بجسدي اندماجا تاما،{FC00}{FD00}فتعذر نزعها عني وأنا فاقدة الوعي.{FC00}"
    },
    {
      "id": "surgery",
      "context": "Samus; monologue 14",
      "text": "فاضطر الأطباء إلى نزع أجزاء\nكبيرة من بدلتي جراحيا،{FC00}{FD00}مما غير مظهري تغييرا\nجذريا. لكن طفيليات إكس{FC00}{FD00}كانت متغلغلة في جهازي\nالعصبي المركزي إلى حد{FC00}{FD00}يستحيل معه استئصالها بأمان،\nفكانت فرص نجاتي ضئيلة.{FC00}"
    },
    {
      "id": "vaccine",
      "context": "Samus; monologue 15",
      "text": "ثم وجد أحدهم علاجا.{FC00}{FC00}{FD00}إذ اقترح استخدام خلايا ميترويد\nلصنع لقاح مضاد لإكس.{FC00}{FD00}ويبدو أن الاتحاد كان قد تمكن من حفظ{FC00}{FD00}مزرعة خلايا من آخر صغير\nميترويد من إس آر ٣٨٨.{FC00}{FD00}فحضر المصل وحقنت به دون إبطاء.{FC00}"
    },
    {
      "id": "reborn",
      "context": "Samus; monologue 16",
      "text": "فقضي على طفيليات إكس في الحال{FC00}{FD00}قضاء تاما.{FC00}{FC00}{FD00}أما أنا، فقد انتهت حياة...\nلكنني نجوت، وولدت من جديد{FC00}{FD00}كائنا مختلفا.{FC00}"
    },
    {
      "id": "metroid_hatchling",
      "context": "Samus; monologue 17",
      "text": "وحين أتأمل ذلك، أدرك...{FC00}{FD00}أنني مدينة لصغير\nالميترويد بحياتي مرتين.{FC00}"
    },
    {
      "id": "arriving",
      "context": "the ship's computer; monologue 18",
      "text": "سنصل قريبا إلى محطة\nالأبحاث بي إس إل.{FC00}{FD00}علي أن أستعد للالتحام.{FC00}"
    },
    {
      "id": "new_mission",
      "context": "Samus; monologue 0",
      "text": "أبلغني حاسوب السفينة باقترابنا من\nمختبرات بيولوجيك الفضائية، أي محطة\nالأبحاث بي إس إل. فأثناء خضوعي\nللجراحة، أرسل فريق الأبحاث إلى هناك\nآخر دفعة من الكائنات التي أسرناها،\nومعها الأجزاء المصابة من بدلة\nالقوة. وبعد أن{FC00}{FD00}استعدت وعيي، علمت أن انفجارا غامضا\nهز المحطة. ولسبب ما، أيقظ ذلك في\nقلبي خوفا لا اسم له، وها أنا ذي أرسل\nالآن إلى هناك للتحقيق.{FC00}{FD00}وسيشرف على مهمتي في محطة\nبي إس إل حاسوب سفينتي الجديد.\nوعلي أن أحتمل طاعة أوامر هذا القائد\nالآلي الفظ، فقد كان ذلك شرطا\nلتسلمي السفينة. وبالنسبة لمن تكره\nتلقي الأوامر مثلي، هذه هي{FC00}{FD00}المرة الثانية التي أجد فيها نفسي\nمضطرة إلى ذلك. وهذا يذكرني\nبقائدي الآخر...{FC00}"
    },
    {
      "id": "first_briefing",
      "context": "the ship's computer; briefing 0 (the first, on the station's map)",
      "text": "{B003}وقع انفجار في {8102}عنبر الحجر الصحي{8100}.{FD00}يضم العنبر حاليا كبسولات تحوي عينات\nجمعت مؤخرا{FD00}من {8102}إس آر ٣٨٨{8100}، وأجزاء من بدلتك\nأصابتها{FD00}{8103}طفيليات إكس{8100}.{FD00}سبب الانفجار غير معروف بعد.\nحققي في الأمر{E000}.{FD00}يقع {8102}عنبر الحجر الصحي{8100} هنا.{FD00}تحركي بسرعة وهدوء...{FD00}ما زلت عاجزة عن استخدام معظم\n{8103}قدراتك الكامنة{8100}.{FD00}لا تنسي ذلك يا سامس.{FD00}توقفي في {8102}غرفة الملاحة{8100} في طريقك،\nواتصلي بي من هناك.{FB00}والآن، اذهبي إلى {8102}عنبر الحجر الصحي{8100}."
    },
    {
      "id": "first_briefing_again",
      "context": "the ship's computer; briefing 1 (the first, when Samus comes back)",
      "text": "اذهبي إلى {8102}عنبر الحجر الصحي{8100}."
    },
    {
      "id": "second_briefing",
      "context": "the ship's computer; briefing 2 (the Navigation Room before the Quarantine Bay)",
      "text": "{8102}عنبر الحجر الصحي{8100} أمامك.{FD00}تأكد وجود {8103}علامات حياة{8100}.\nكوني حذرة."
    },
    {
      "id": "second_briefing_again",
      "context": "the ship's computer; briefing 3 (the second, when Samus comes back)",
      "text": "{8102}عنبر الحجر الصحي{8100} أمامك مباشرة."
    },
    {
      "id": "objective_clear",
      "context": "the ship's computer; message 43 (the question after a briefing)",
      "text": "{8041}هل هدفك واضح؟\n{8057}{8340}نعم {83A0}لا"
    },
    {
      "id": "confirm_objective",
      "context": "the ship's computer; message 44 (the question when a briefing comes again)",
      "text": "{800C}هل تريدين التأكد من هدف المهمة؟\n{8057}{8340}نعم {83A0}لا"
    }
  ]
}
